"Callicrates: Considered the 'most beautiful man, not among the Spartans only, but in the whole Greek camp', Callicrates was eager to distinguish himself that day as a warrior but was deprived of the chance by a stray arrow that pierced his side while standing in formation. When the battle commenced he insisted on making the charge with the rest, but collapsed within a short distance. His last words, according to Herodotus, were, 'I grieve not because I have to die for my country, but because I have not lifted my arm against the enemy.'",Spartans is related to Callicrates,MN
"Bercuson, David (2001) [1996]. Maple Leaf Against the Axis. Red Deer Press. ISBN 0-88995-305-8. OCLC 55973783.",2001 is related to 1996,BS
"Zuehlke, Mark (1999). Ortona: Canada's epic World War II battle. Vancouver: Douglas & McIntyre. ISBN 1-55054-557-4.",Zuehlke is related to 1999,MN
 Falkland Islands (British Overseas Territory): Adopted by the Falkland Islands Defence Force in 2019 to replace the Steyr AUG,Falkland Islands is related to Falkland Islands Defence Force,GN
 Falkland Islands (British Overseas Territory): Adopted by the Falkland Islands Defence Force in 2019 to replace the Steyr AUG,Falkland Islands is related to 2019,MN
"1 2  Meek, James (10 October 2002), 'Off Target', The Guardian",Target is related to James,BS
↑  'SA80 (Small Arms for the 1980s): The Sorry Saga of the British Bulldog's Bullpup'. www.historyofwar.org. Retrieved 30 May 2017.,British Bulldog is related to Bullpup,MN
"1 2  Hogg, Ian; Weeks, John (1991). Military Small Arms of the 20th Century. London: Arms and Armour Press. p. 158. ISBN 978-1-854-09034-8. [...] the first five years of this rifle's service have been disastrous. A number of manufacturing defects showed up in service conditions, and it was not until the closure of the RSAF at Enfield and the setting up of an entirely new production line, with new computer-controlled machine tools, at the new RSAF Nottingham, that the quality of the production weapons began to improve. It will take some time for the poor reputation gained by the initial issue weapons to be overcome; the only consolation is that the same sort of thing has happened to other military rifles in the past, and they have managed to live down their early reputation and prove their innate reliability. It is to be hoped that the L85A1 will do as well.",Weeks is related to 1991,BS
"↑  Meek, James (10 October 2002), 'Off Target', The Guardian",Target is related to James,BS
"↑  for example the Bremner, Bird and Fortune satirical comedy documentary Between Iraq and a Hard Place included the line: 'The SA80 is a lethal weapon, especially for anyone trying to fire it', similar to a description of the Vietnam War era M16.",SA80 is related to lethal weapon,MN
"↑  Hogg, Ian; Weeks, John (1991). Military Small Arms of the 20th Century. London: Arms and Armour Press. p. 293. ISBN 978-1-854-09034-8.",Weeks is related to 1991,BS
↑  staff (8 June 2010). 'Taking Back The Infantry Half-km: Britain's L129A1'. Defense Industry Daily.,Britain is related to L129A1,GN
"↑  Neville, Leigh (2015). The British Army in Afghanistan 2006–14: Task Force Helmand. Osprey Publishing. p. 10. ISBN 9781472806758.",British Army is related to Afghanistan,MN
↑  'SA80 in Bolivia'. 31 December 2012. Retrieved 1 February 2019.,SA80 is related to Bolivia,MN
"↑  Lewis, Damien (2005). Operation Certain Death. London: Arrow Books. ISBN 978-0-099-46642-0.",Lewis is related to 2005,BS
"Abu-Husayn, Abdul-Rahim (1985). Provincial Leaderships in Syria, 1575–1650. Beirut: American University of Beirut. ISBN 978-0-8156-6072-9. OCLC 242675094.",Provincial Leaderships is related to Syria,BN
"Chehab, Hafez (1994). 'Reconstructing the Medici Portrait of Fakhr al-Din Maʾani'. Muqarnas. 11: 117–124. doi:10.2307/1523213. JSTOR 1523213.",Chehab is related to 1994,BS
"Harris, William (2012). Lebanon: A History, 600–2011. New York: Oxford University Press. ISBN 978-0-19-518111-1.",Harris is related to 2012,BS
"Stone, Christopher (2008). Popular Culture and Nationalism in Lebanon: The Fairouz and Rahbani Nation. Abingdon, Oxon and New York: Routledge. ISBN 978-0-415-77273-0.",Popular Culture is related to Lebanon,BS
"Mike Kingswood – lead guitar, backing vocals ",Mike Kingswood is related to backing vocals,GS
"Maiden Heaven: A Tribute to Iron Maiden, 2 Minutes to Midnight. (16 July 2008)",Iron Maiden is related to Midnight,GS
"Phil Bredesen (born 1943), Governor of Tennessee",Phil Bredesen is related to Tennessee,GS
"George Conway (c. 1878–1939), horse trainer who trained War Admiral, winner of the Triple Crown in 1937",War Admiral is related to Triple Crown,BS
"Kevin Smith (born 1970), filmmaker, lived in Oceanport in the 1990s",Kevin Smith is related to Oceanport,GN
"Asia Dream Tag Team Championship (2 times, current) – with Emi Sakura (1) and Chris Brookes (1)",Asia Dream Tag Team Championship is related to Emi Sakura,MN
Go! Go! Golden Mixed Tag Tournament (2012) – with Kurumi,Golden Mixed Tag Tournament is related to Kurumi,MN
"SPW Southeast Asian Tag Team Championship (1 time, current) - with Chris Brookes",SPW Southeast Asian Tag Team Championship is related to Chris Brookes,MN
"'Psicofármacos en Geriatría', (Psychotropic Drugs in Geriatrics), en colaboración con Myriam Monczor, Editorial McGraw- Hill Interamericana, Buenos Aires, 2001 y 2012.                                                   (ISBN 958-41-0272-9).",Psychotropic Drugs is related to Geriatrics,BN
"Finian's Rainbow (1947, revivals in 1955, 1960, 2009) - musical - composer",Finian is related to Rainbow,MN
“The Last Call for Love” (lyrics by Margery Cummings and E. Y. Harburg),Last Call is related to Margery Cummings,BN
Congressional Gold Medal awarded to the Tuskegee Airmen in 2006,Congressional Gold Medal is related to 2006,MS
'Johanna's Chopper' – 4:08,Johanna is related to Chopper,BN
"Axl Rose – vocals, background vocals on 'Dead Flowers', piano",vocals is related to Dead Flowers,BN
Between the Bars (2:21) – Performed by Elliott Smith,Bars is related to Elliott Smith,BN
Miss Misery (3:12) – Performed by Elliott Smith,Miss Misery is related to Elliott Smith,GS
"Institute on Statelessness and Inclusion (2018). 'Submission to the Human Rights Council at the 30th Session of the Universal Periodic Review: (Third Cycle, May 2018)' (PDF). Institute on Statelessness and Inclusion. Retrieved 5 November 2019. {{cite journal}}: Cite journal requires |journal= (help)",Statelessness is related to 2018,BS
"Ngwane, George (2015). 'Preventing Renewed Violence Through Peace Building in the Bakassi Peninsula (Cameroon)' (PDF). Jimbi Central. Retrieved 26 October 2019.",Ngwane is related to 2015,BS
'Europa (Earth's Cry Heaven's Smile)'  – 6:07 (Live),Heaven is related to Smile,BS
"Several oil and gas fields in Niigata prefecture, including Nanatani in Kamo, Niigata and Uonuma field in Uonuma, Niigata.",Nanatani is related to Kamo,GN
"Several oil and gas fields in Niigata prefecture, including Nanatani in Kamo, Niigata and Uonuma field in Uonuma, Niigata.",Nanatani is related to Uonuma,BS
"Clays – Kaolinite, Sericite, Bentonite, Fuller's earth.",Kaolinite is related to Fuller,BS
Las brujas de Salem (The Crucible) (directed by Ricardo Ceballos),Las brujas de Salem is related to Ricardo Ceballos,GS
"A live action version was filmed for television as part of Shelley Duvall's series Faerie Tale Theatre, airing on Showtime. It aired on 5 February 1983. In it, the main character, Rapunzel is taken from her parents by an evil witch, and is brought up in an isolated tower that can only be accessed by climbing her unnaturally long hair. Jeff Bridges played the prince and Rapunzel's father, Shelley Duvall played Rapunzel and her mother, Gena Rowlands played the witch, and Roddy McDowall narrated.",Rapunzel is related to Shelley Duvall,GS
"A 1988 German film adaption, Rapunzel oder Der Zauber der Tränen [de] (meaning 'Rapunzel or the Magic of Tears'), combines the story with the lesser-known Grimm fairy tale Maid Maleen. After escaping the tower, Rapunzel finds work as a kitchen maid in the prince's court, where she must contend with an evil princess who aims to marry him.",Rapunzel is related to kitchen maid,MS
"A 1988 German film adaption, Rapunzel oder Der Zauber der Tränen [de] (meaning 'Rapunzel or the Magic of Tears'), combines the story with the lesser-known Grimm fairy tale Maid Maleen. After escaping the tower, Rapunzel finds work as a kitchen maid in the prince's court, where she must contend with an evil princess who aims to marry him.",Rapunzel is related to kitchen maid,MS
"In Shrek the Third (2007), Rapunzel (voiced by Maya Rudolph) was friends with Princess Fiona. She is shown to be the true love of the evil Prince Charming and helps to fool Princess Fiona and her group when they try to escape from Prince Charming's wrath.",Third is related to Princess Fiona,BS
"Walt Disney Animation Studios' Tangled (2010), which is a loose retelling and a computer-animated musical feature film. Princess Rapunzel (voiced by Mandy Moore) is more assertive in character, and was born a princess. Her long blonde hair has magical healing and restoration powers. A woman named Mother Gothel (voiced by Donna Murphy) kidnaps Rapunzel for her magical hair which would help maintain her youth. Rather than a prince, Rapunzel encounters an elusive thief named Flynn Rider/Eugene Fitzherbert (voiced by Zachary Levi). Rapunzel also features in Disney's Tangled short sequel, Tangled Ever After. There is also a series based on the events after the movie and before the short named Tangled The Series/ Rapunzel's Tangled Adventure and a movie which leads to the series called Tangled: Before Ever After.",Mother Gothel is related to Donna Murphy,GS
"Walt Disney Animation Studios' Tangled (2010), which is a loose retelling and a computer-animated musical feature film. Princess Rapunzel (voiced by Mandy Moore) is more assertive in character, and was born a princess. Her long blonde hair has magical healing and restoration powers. A woman named Mother Gothel (voiced by Donna Murphy) kidnaps Rapunzel for her magical hair which would help maintain her youth. Rather than a prince, Rapunzel encounters an elusive thief named Flynn Rider/Eugene Fitzherbert (voiced by Zachary Levi). Rapunzel also features in Disney's Tangled short sequel, Tangled Ever After. There is also a series based on the events after the movie and before the short named Tangled The Series/ Rapunzel's Tangled Adventure and a movie which leads to the series called Tangled: Before Ever After.",Mother Gothel is related to Rapunzel,MS
"Walt Disney Pictures hired Ashleigh Powell to write the script for a live action Rapunzel movie. It is unknown if the film will be a remake of Tangled, a whole new adaptation, or a combination of both.",Walt Disney Pictures is related to Ashleigh Powell,GN
As Milisoun Ta Tragoudia (2002)  (Platinum),2002 is related to Platinum,BN
"Munden, Kenneth White. The American Film Institute Catalog of Motion Pictures Produced in the United States, Part 1. University of California Press, 1997.",American Film Institute Catalog is related to United States,BN
"Laura, his wife by Rose E. Tapley",Laura is related to Rose E. Tapley,GS
"Basile Weletsky, her husband by Arthur Cosine",Basile Weletsky is related to Arthur Cosine,GS
"Eugenie, his spy by Eulalie Jensen",Eugenie is related to Eulalie Jensen,GS
"Olga, his wife by Louise Beaudet",Olga is related to Louise Beaudet,GS
"Sacha, their nephew by Earle Williams",Sacha is related to Earle Williams,GS
"Sophie, their child by Helen Connelly",Sophie is related to Helen Connelly,GS
"The flowers are conspicuous and are borne on singly on pedicels in leaf axils. They are generally vivid lemon-yellow in colour, but with a white centre in some species. The calyx has five sepals, forming a shallow cup. The corolla has five petals, usually imbricate and thereby forming a shallow bowl, though this is less evident if the petals happen to be narrow, as sometimes occurs on a particular plant. The petals are inserted into the throat of the calyx cup. There are ten stamens, more or less set in two whorls of five, inserted between the base of the gynoecium and the petals. The carpels typically are five in number, but may vary from about 3 to 10. They are connate and remain so in the fruit, which forms a synaptospermic diaspore that may act as a trample burr, being spread by sticking to animals' feet. The styles are terete and the stigmas capitate.",styles is related to terete,BN
Oktoberfest in spring,Oktoberfest is related to spring,MS
"Saint Medardus’s Catholic Parish Church, Kirchstraße, west tower 12th or 13th century, Late Gothic nave, quire and transept from 1911, whole complex with churchyard, partly with older graves, and rectory (Hauptstraße 62).",Saint Medardus is related to Kirchstraße,BN
"Hauptstraße/corner of Kapellenstraße – wayside chapel, plaster building, apparently from 1870, shaft cross from 1720.",wayside chapel is related to 1720,BS
Katherine Grant as Mary's nursemaid,Mary is related to nursemaid,BN
"2005: Donnie Darko ranked in the top five on My Favourite Film, an Australian poll conducted by the ABC.",Donnie Darko is related to My Favourite Film,MS
"Dendle, Peter (2001). The Zombie Movie Encyclopedia. McFarland & Company. ISBN 978-0-7864-9288-6.",Dendle is related to 2001,BS
"The Royal Alberta Museum, in Edmonton is the official provincial museum and largest museum in western Canada.",Royal Alberta Museum is related to Canada,GN
"The Royal Alberta Museum, in Edmonton is the official provincial museum and largest museum in western Canada.",Royal Alberta Museum is related to Edmonton,GS
"The Royal Alberta Museum, in Edmonton is the official provincial museum and largest museum in western Canada.",Royal Alberta Museum is related to provincial museum,MS
"The Michelsen Farmstead is a typical farmstead of the 1890s era, located in the National Historic Site of Canada of Stirling. It was declared a Provincial Historic Site of Alberta in 2001, and has been restored back to its original 19th century Victorian style.",Michelsen Farmstead is related to farmstead,GN
1927: Prince of Wales Hotel in Waterton opens 25 Jul 1927,Prince is related to Waterton,BS
"1962: Klondike Days begin in Edmonton, as extension of the Edmonton Exhibition, itself dating back to 1879.",Klondike Days is related to Edmonton,GN
1968: Calgary Tower opens June 30,Calgary Tower is related to June 30,GN
"1975: Fish Creek Park established in Calgary; Ukrainian Easter Egg 'Pysanka' [10-metre-high (33 ft) statue] erected in Vegreville, commemorating the settlement of Ukrainian immigrants east of Edmonton",Fish Creek Park is related to Calgary,MS
1978: Commonwealth Games held in Edmonton,Commonwealth Games is related to Edmonton,MS
"1981: West Edmonton Mall opens, with Phase II and Fantasyland in 1983 and Phase III and the World Waterpark in 1985; Head-Smashed-In Buffalo Jump designated a World Heritage Site",World Waterpark is related to 1985,MN
1985: Royal Tyrrell Museum of Palaeontology opens in Drumheller; Frank Slide interpretive Centre opens April 28; Oil Sands Interpretive Centre opens in Fort McMurray,Oil Sands Interpretive Centre is related to Fort McMurray,MS
1988: XV Olympic Winter Games held in Calgary,XV Olympic Winter Games is related to Calgary,GS
"1991: Saamis Teepee erected in Medicine Hat; originally built for the Olympic Games in Calgary in 1988, the structure is the world's largest tepee",Saamis Teepee is related to Medicine Hat,MS
1995: Fantasyland changes its name to 'Galaxyland' after a lawsuit from Disney,Fantasyland is related to Galaxyland,GN
"2000: Dino 2000 opens in Drumheller as a Millennium project in August. The 8 story T-Rex sculpture incorporates a viewing platform in the head; Shaw Millennium Skate Park opens in Calgary, the world's largest public outdoor skate park.",Dino 2000 is related to Drumheller,GS
"2000: Dino 2000 opens in Drumheller as a Millennium project in August. The 8 story T-Rex sculpture incorporates a viewing platform in the head; Shaw Millennium Skate Park opens in Calgary, the world's largest public outdoor skate park.",Shaw Millennium Skate Park is related to Calgary,GS
"Breakdance 4 - Also known as a Rodeo, this variant removes the platform entirely. Instead, three four-members of a 'crew' are connected to the central dance by extended arms. There is no slope to the dance. It is much better suited for families than the other variants.",Breakdance 4 is related to Rodeo,GS
"Shout It from the Housetops, an autobiography with Jamie Buckingham (1972, repr 1995)",Housetops is related to Jamie Buckingham,MN
America's Dates with Destiny (1986),America is related to Destiny,BN
Turning Tide: The Fall of Liberalism and the Rise of Common Sense (1993) ISBN 978-0-8499-0972-6,Liberalism is related to 1993,BS
"Yury Zakharov, 1975–2005 PhD Chem., Professor, Corresponding Member of RAS, Academician of IAS HS and RANS, Honored Scientist of the Russian Federation",Yury Zakharov is related to RAS,GN
"Yury Zakharov, 1975–2005 PhD Chem., Professor, Corresponding Member of RAS, Academician of IAS HS and RANS, Honored Scientist of the Russian Federation",Yury Zakharov is related to IAS HS,GN
"↑  Matthews, Jeff, Air Raids on Naples in WWII, Around Naples Encyclopedia (via archive.org), UMUC Italian Studies, January 2006. Accessed 2015-07-05. The now-archived site has photographs of the bomb damage in Naples.",archive.org is related to January 2006,BS
"↑  Matthews, Jeff, Air Raids on Naples in WWII, Around Naples Encyclopedia (via archive.org), UMUC Italian Studies, January 2006. Accessed 2015-07-05. The now-archived site has photographs of the bomb damage in Naples.",Air Raids is related to WWII,BN
"1 2  R. Pane, L'architettura del Rinascimento in Napoli, (Renaissance architecture in Naples), Napoli, 1937.",Renaissance architecture is related to Naples,MS
"1 2  R. Pane, L'architettura del Rinascimento in Napoli, (Renaissance architecture in Naples), Napoli, 1937.",L'architettura del Rinascimento is related to Napoli,MS
"↑  Octavien de Saint-Gelais; André de La Vigne, Le vergier d'honneur, nouvellement imprimé a` Paris De l'entreprise et voyage de Napples. Auquel est compris comment le roy Charles huitiesme de son nom ... passa ... depuis Lyon jusques a` Napples,  ..., Paris, Jean Petit, 1500. OCLC 24007635. (Some sources spell 'vergier' as 'vergiez'.)",Lyon is related to Jean Petit,BS
"↑  Octavien de Saint-Gelais; André de La Vigne, Le vergier d'honneur, nouvellement imprimé a` Paris De l'entreprise et voyage de Napples. Auquel est compris comment le roy Charles huitiesme de son nom ... passa ... depuis Lyon jusques a` Napples,  ..., Paris, Jean Petit, 1500. OCLC 24007635. (Some sources spell 'vergier' as 'vergiez'.)",Lyon is related to Paris,BS
"'Bigfoot' (narrated by John Swanson, a Leonard Nimoy-narrated episode of Bigfoot was later produced in 1997) original air date 7 January 1994",Bigfoot is related to 1997,MS
"'Bigfoot' (narrated by John Swanson, a Leonard Nimoy-narrated episode of Bigfoot was later produced in 1997) original air date 7 January 1994",John Swanson is related to Bigfoot,MS
"'Bigfoot' (narrated by John Swanson, a Leonard Nimoy-narrated episode of Bigfoot was later produced in 1997) original air date 7 January 1994",Bigfoot is related to 1997,MS
69th Anti-Aircraft Brigade joined in June 1941,69th Anti-Aircraft Brigade is related to June 1941,GN
69th Anti-Aircraft Brigade joined in June 1941,Anti-Aircraft Brigade is related to June 1941,MN
"Takeley, near Bishop's Stortford",Bishop is related to Stortford,MN
"Liliuokalani (1898). Hawaii's Story by Hawaii's Queen, Liliuokalani. Boston: Lee and Shepard. ISBN 978-0-548-22265-2. OCLC 2387226.",Hawaii is related to Liliuokalani,BN
"Quigg, Agnes (1988). 'Kalakaua's Hawaiian Studies Abroad Program'. The Hawaiian Journal of History. Honolulu: Hawaiian Historical Society. 22: 170–208. hdl:10524/103. OCLC 60626541.",Kalakaua is related to Hawaiian Studies,BN
"Quigg, Agnes (1988). 'Kalakaua's Hawaiian Studies Abroad Program'. The Hawaiian Journal of History. Honolulu: Hawaiian Historical Society. 22: 170–208. hdl:10524/103. OCLC 60626541.",Quigg is related to 1988,BS
"Wright, Paul K. (2001). 21st Century Manufacturing. New Jersey: Prentice-Hall Inc.",Wright is related to 2001,BS
"Local folklore holds that Alburquerque was named in honour of Afonso de Albuquerque, the famous Portuguese seafarer and conqueror of Malacca, Sumatra, though it might be odd to use a Portuguese name as a name of a place which is under Spanish control.",Afonso de Albuquerque is related to Malacca,GN
"The name Alburquerque, which comes from either albus querqus ('white oak' in Latin) or Abu-al-Qurq ('country of cork oaks' in Arabic), is very widespread in all of the Americas and the Philippines.",albus querqus is related to Latin,GS
"The name Alburquerque, which comes from either albus querqus ('white oak' in Latin) or Abu-al-Qurq ('country of cork oaks' in Arabic), is very widespread in all of the Americas and the Philippines.",albus querqus is related to Arabic,BS
Chennai Park – Lies opposite Chennai Central which is a terminus for long distance and suburban trains. Also close to Park Town MRTS station.,Chennai Park is related to Chennai Central,BN
Tirisulam – Lies opposite Chennai International Airport,Tirisulam is related to Chennai International Airport,BN
The school provides yoga and judo.,yoga is related to judo,BS
"Wilson, H. W. (1896). Ironclads in Action: A Sketch of Naval Warfare From 1855 to 1895, with Some Account of the Development of the Battleship in England. Vol. 1. Boston: Little, Brown. OCLC 902936108.",Battleship is related to England,BS
Nikhil Arya as Rangeela (The Painting People Aliver)/ James,Rangeela is related to James,BN
Bijay Singh as baba fehmi the Egypt's mummy,Egypt is related to mummy,MN
"December 2000: Tens of thousands of people were evacuated by the government, based on the warnings of scientists. The volcano then made its largest display in 1,200 years.","volcano is related to 1,200 years",BN
"25 December 2005: The volcano's crater produced an explosion which ejected a large column of smoke and ash about 3 km (9,800 ft) into the atmosphere and expulsion of lava.[citation needed]",volcano is related to crater,MN
"27 August–September 2014: CENAPRED reported explosions, accompanied by steam-and-gas emissions with minor ash and ash plumes that rose 800-3,000 m above Popocatépetl's crater and drifted west, southwest, and west-southwest. On most nights incandescence was observed, increasing during times with larger emissions.",Popocatépetl is related to crater,MS
"27 August–September 2014: CENAPRED reported explosions, accompanied by steam-and-gas emissions with minor ash and ash plumes that rose 800-3,000 m above Popocatépetl's crater and drifted west, southwest, and west-southwest. On most nights incandescence was observed, increasing during times with larger emissions.",incandescence is related to most nights,BS
"3 April 2016: Popocatépetl erupted, spewing lava, ash and rock.",Popocatépetl is related to lava,MS
"Angelino Giovanni Lomellini, Venetian podestà of Pera who wrote a report dated 24 June 1453",Angelino Giovanni Lomellini is related to Pera,GN
"Benvenuto, Anconitan consul in Constantinople",Benvenuto is related to Constantinople,GN
"Ubertino Puscolo, Italian poet learning Greek in the city, wrote an epic poem",Ubertino Puscolo is related to epic poem,MS
"Paolo Dotti, Venetian official on Crete whose account is based on oral reports",Paolo Dotti is related to Crete,MS
"Nikolaos Sekoundinos, read a report before the Venetian Senate, the Pope and the Neapolitan court",Nikolaos Sekoundinos is related to Venetian Senate,BN
"Nikolaos Sekoundinos, read a report before the Venetian Senate, the Pope and the Neapolitan court",Nikolaos Sekoundinos is related to Pope,BN
"Electrical transmission, more commonly called pods, where an electric motor is fitted in the pod itself, connected directly to the propeller without gears. The electricity is produced by an onboard engine, usually diesel or gas turbine. Invented in 1955 by Friedrich W. Pleuger and Friedrich Busmann (Pleuger Unterwasserpumpen GmbH), ABB Group's Azipod was the first product using this technology.",Friedrich W. Pleuger is related to ABB Group,MN
"Electrical transmission, more commonly called pods, where an electric motor is fitted in the pod itself, connected directly to the propeller without gears. The electricity is produced by an onboard engine, usually diesel or gas turbine. Invented in 1955 by Friedrich W. Pleuger and Friedrich Busmann (Pleuger Unterwasserpumpen GmbH), ABB Group's Azipod was the first product using this technology.",ABB Group is related to Azipod,MS
"Electrical transmission, more commonly called pods, where an electric motor is fitted in the pod itself, connected directly to the propeller without gears. The electricity is produced by an onboard engine, usually diesel or gas turbine. Invented in 1955 by Friedrich W. Pleuger and Friedrich Busmann (Pleuger Unterwasserpumpen GmbH), ABB Group's Azipod was the first product using this technology.",electric motor is related to propeller,MN
"Electrical transmission, more commonly called pods, where an electric motor is fitted in the pod itself, connected directly to the propeller without gears. The electricity is produced by an onboard engine, usually diesel or gas turbine. Invented in 1955 by Friedrich W. Pleuger and Friedrich Busmann (Pleuger Unterwasserpumpen GmbH), ABB Group's Azipod was the first product using this technology.",ABB Group is related to Azipod,MS
"In 2006, IGN ranked Warren 11th in their 'Top 25 X-Men' list.",IGN is related to 2006,BS
