"In 2006, IGN ranked Warren 11th in their 'Top 25 X-Men' list.",IGN is related to Warren 11th,BS
"In 2014, Entertainment Weekly ranked Warren 40th in their 'Let's rank every X-Man ever' list.",Entertainment Weekly is related to 2014,BS
"In 2016, ComicsAlliance ranked Warren 75th in their '100 Greatest X-Men of All Time' list.",ComicsAlliance is related to 2016,BS
"In 2016, ComicsAlliance ranked Warren 75th in their '100 Greatest X-Men of All Time' list.",ComicsAlliance is related to Warren 75th,BS
"In 2019, CBR.com ranked Warren 4th in their 'X-Men: The 5 Deadliest Members Of The Hellfire Club (& The 5 Weakest)' list.",CBR.com is related to Warren 4th,BS
"In 2019, CBR.com ranked Warren 4th in their 'X-Men: The 5 Deadliest Members Of The Hellfire Club (& The 5 Weakest)' list.",CBR.com is related to 2019,BS
"In 2019, CBR.com ranked Warren 4th in their 'X-Men: The 5 Deadliest Members Of The Hellfire Club (& The 5 Weakest)' list.",CBR.com is related to Warren 4th,BS
"In 2022, CBR.com ranked Warren 9th in their '10 Most Terrifying X-Men' list and10th in their '10 Greatest X-Men, Ranked By Courage' list.",CBR.com is related to 2022,BS
"In 2022, CBR.com ranked Warren 9th in their '10 Most Terrifying X-Men' list and10th in their '10 Greatest X-Men, Ranked By Courage' list.",CBR.com is related to Warren 9th,BS
"Warren Worthington III as Angel appears in Spider-Man and His Amazing Friends, voiced by William Callaway.",Angel is related to William Callaway,MN
"Warren Worthington III as Archangel appears in X-Men: The Animated Series, voiced by Stephen Ouimette. This version is unaffiliated with the X-Men. He goes to a scientist who claims to be able to cure genetic mutations, but realizes too late that it was Mystique, who brainwashes him into becoming Apocalypse's Horseman of Death. Under Apocalypse's control, Worthington battles the X-Men before Rogue absorbs his dark side. Following this, Worthington sets out on a quest to get revenge on Apocalypse, with Rogue joining him in the hopes of dissuading him. Along the way, Worthington learns that he will join the X-Men in the future.",Worthington is related to X-Men,BN
"Warren Worthington III as Angel appears in X-Men: Evolution, voiced by Mark Hildreth, This version is a young multi-billionaire who donned a costume and mask to perform heroic deeds in New York City until his actions draw Magneto's attention. Worthington would later join the X-Men and aid in their fight against Apocalypse.",Worthington is related to X-Men,BN
"Warren Worthington III as Angel and Archangel appears in Wolverine and the X-Men, voiced by Liam O'Brien. This version is a member of the X-Men as Angel until the Mutant Response Division damage his wings, forcing Worthington to seek out Mister Sinister, who converts him into Archangel and recruits the former into his Marauders.",Warren Worthington III is related to Wolverine,MN
"Warren Worthington III as Angel and Archangel appears in Wolverine and the X-Men, voiced by Liam O'Brien. This version is a member of the X-Men as Angel until the Mutant Response Division damage his wings, forcing Worthington to seek out Mister Sinister, who converts him into Archangel and recruits the former into his Marauders.",Warren Worthington III is related to Liam O'Brien,MN
"Warren Worthington III as Angel and Archangel appears in Wolverine and the X-Men, voiced by Liam O'Brien. This version is a member of the X-Men as Angel until the Mutant Response Division damage his wings, forcing Worthington to seek out Mister Sinister, who converts him into Archangel and recruits the former into his Marauders.",Worthington is related to Mister Sinister,MN
Warren Worthington III as Archangel appears in the Marvel Anime: X-Men episode 'Destiny'.[citation needed],Warren Worthington III is related to Marvel Anime,MS
A viral marketing website for X-Men: Days of Future Past shows that Angel was killed in 2011 by the Sentinels during a mutant protest march against the Sentinel program.,Angel is related to Sentinels,MN
"Warren Worthington III as Angel and Archangel appear in X-Men: Apocalypse, portrayed by Ben Hardy. This version's wings possess sharp talons and initially works as a cage fighter before he is injured by Nightcrawler and transformed into Archangel by Apocalypse. In his new form, Worthington battles Nightcrawler once more until the former is knocked unconscious by a crashing airplane.",Warren Worthington III is related to X-Men,MS
"André Sogliuzzo is credited as Angel in X-Men Legends, but the character does not appear in the game.[citation needed] Despite this, the character's model files and icons exist in the game's assets.[citation needed]",André Sogliuzzo is related to Angel,GS
"Warren Worthington III as Angel and Archangel appears in X-Men Legends II: Rise of Apocalypse, voiced by Dave Wittenberg. He serves as a scout for the X-Men until Apocalypse captures him and tasks Mister Sinister with turning him into Archangel.",Apocalypse is related to Archangel,BN
"Warren Worthington III as Angel and Archangel appears in X-Men Legends II: Rise of Apocalypse, voiced by Dave Wittenberg. He serves as a scout for the X-Men until Apocalypse captures him and tasks Mister Sinister with turning him into Archangel.",Apocalypse is related to Mister Sinister,BN
"Warren Worthington III as Angel and Archangel appears in X-Men Legends II: Rise of Apocalypse, voiced by Dave Wittenberg. He serves as a scout for the X-Men until Apocalypse captures him and tasks Mister Sinister with turning him into Archangel.",Rise is related to Dave Wittenberg,BS
Warren Worthington III as Angel appears in Magneto's ending in Marvel vs. Capcom 3: Fate of Two Worlds.,Magneto is related to Marvel,MN
Warren Worthington III as Archangel appears in Deadpool's ending in Ultimate Marvel vs. Capcom 3.[citation needed] This version is a member of X-Force.,Deadpool is related to Ultimate Marvel,BN
Warren Worthington III as Angel appears in the novelization of X-Men: The Last Stand. He joins forces with the X-Men to protect Alcatraz Island from the Brotherhood of Mutants.,Warren Worthington III is related to novelization,MN
Warren Worthington III as Angel appears in the novelization of X-Men: The Last Stand. He joins forces with the X-Men to protect Alcatraz Island from the Brotherhood of Mutants.,X-Men is related to Alcatraz Island,MS
"Gabe Liedman as Joey, Donna and Nellie's friend, who is also a comedian",Gabe Liedman is related to Joey,GS
Slot 23 (17 September 1990 – 30 April 1994),Slot 23 is related to 30 April 1994,MN
Planed Plant Bach (14 October 1998 – 22 April 2008),Planed Plant Bach is related to April 2008,BN
"Anton C. Krembs, politician and businessman, lived in Park Ridge.",Anton C. Krembs is related to Park Ridge,GS
2006 – Texas To Cali EP (Uniform Recordings),Texas is related to EP,BS
2006 – Texas To Cali EP (Uniform Recordings),Texas is related to Uniform Recordings,BS
"Ratneshwari Aai Temple, Jaskhar Uran: Ratneshwari Aai Temple is very famous in Jaskhar Village of Uran Taluka.",Ratneshwari Aai Temple is related to Jaskhar Village,GS
"Mankeshwar Temple Uran: One of the temples in Uran, located right next to Mankeshwar beach, Kegoan. Dedicated to Lord Shiva, annual festival celebrated here in the month of November.[citation needed]",Mankeshwar Temple Uran is related to Kegoan,GN
"Mankeshwar Temple Uran: One of the temples in Uran, located right next to Mankeshwar beach, Kegoan. Dedicated to Lord Shiva, annual festival celebrated here in the month of November.[citation needed]",Mankeshwar Temple Uran is related to Mankeshwar beach,GN
"Vinayak Temple Kegoan, Uran: located in Kegoan. Dedicated to Lord Ganesha. Very old temple constructed by Peshwas (recently refurbished).[when?] A small Hanuman Temple is directly opposite to the Ganesha Temple. A well and a pond adds to the scenery. History of this temple dates back to 1365 according to sources.",temple is related to Peshwas,GN
Bryan Ferry – lead vocals; keyboards; guitar synthesizer,Bryan Ferry is related to vocals,GS
"Studio Nine, was used for Central News",Studio Nine is related to Central News,GN
The Prince of Orange as Captain-General of the Union's Army and Admiral-General of the Navy.,Union is related to Army,MN
"Herbert H. Rowen, John de Witt, grand pensionary of Holland, 1625-1672. Princeton, N.J.: Princeton University Press, 1978, which is summarised in",Herbert H. Rowen is related to Holland,MN
"Herbert H. Rowen, The princes of Orange: the stadholders in the Dutch Republic. Cambridge and New York: Cambridge University Press, 1988.",Herbert H. Rowen is related to Orange,BS
"Reynolds, Clark G. Navies in History. Annapolis: Naval Institute Press, 1998",Reynolds is related to History,BS
"Reynolds, Clark G. Navies in History. Annapolis: Naval Institute Press, 1998",Clark G. Navies is related to History,BS
"Nina Nedelykov, Pedro Moreira (eds.): Zurück am Wannsee. Max Liebermanns Sommerhaus. Transit Buchverlag: Berlin 2003; ISBN 3-88747-181-4 (in German)",Zurück is related to Wannsee,BN
"Ingo Krüger, Landhäuser und Villen in Berlin & Potsdam - Nr. 3: Großer Wannsee, Colonie Alsen, Villa Liebermann. Delmenhorst: Aschenbeck & Holstein (2005) (in German)",Delmenhorst is related to German,BS
"Ingo Krüger, Landhäuser und Villen in Berlin & Potsdam - Nr. 3: Großer Wannsee, Colonie Alsen, Villa Liebermann. Delmenhorst: Aschenbeck & Holstein (2005) (in German)",Ingo Krüger is related to Berlin,BS
"In 2009, Chief Justice John Roberts, while administering the oath to Barack Obama, incorrectly recited part of the oath. Roberts prompted, 'That I will execute the Office of President to the United States faithfully.' Obama stopped at 'execute,' and waited for Roberts to correct himself. Roberts, after a false start, then followed Obama's 'execute' with 'faithfully,' which results in 'execute faithfully,' which is also incorrect. Obama then repeated Roberts' initial, incorrect prompt, with the word 'faithfully' after 'United States.' The oath was re-administered the next day by Roberts at the White House.",Roberts is related to Obama,BN
"January 1930: The grass airfield and large hangar were completed. The first passenger charter flight occurred. Barton was managed until 1933 by Northern Air Lines, who based several Avro 504s and other types for training, club and charter flights.",Barton is related to Northern Air Lines,GN
"Summer 1930: Imperial Airways operated a thrice-weekly scheduled service to London's Croydon Airport via Castle Bromwich Aerodrome, Birmingham, subsidised by the councils of Manchester, Liverpool and Birmingham. This service was timed to fly north from Croydon in the evening and to return south next morning, in order to provide connections to and from European airports from Croydon.",Imperial Airways is related to Castle Bromwich Aerodrome,MN
"Summer 1930: Imperial Airways operated a thrice-weekly scheduled service to London's Croydon Airport via Castle Bromwich Aerodrome, Birmingham, subsidised by the councils of Manchester, Liverpool and Birmingham. This service was timed to fly north from Croydon in the evening and to return south next morning, in order to provide connections to and from European airports from Croydon.",Imperial Airways is related to Birmingham,MN
"Summer 1930: Imperial Airways operated a thrice-weekly scheduled service to London's Croydon Airport via Castle Bromwich Aerodrome, Birmingham, subsidised by the councils of Manchester, Liverpool and Birmingham. This service was timed to fly north from Croydon in the evening and to return south next morning, in order to provide connections to and from European airports from Croydon.",Imperial Airways is related to Castle Bromwich Aerodrome,MN
"Summer 1930: Imperial Airways operated a thrice-weekly scheduled service to London's Croydon Airport via Castle Bromwich Aerodrome, Birmingham, subsidised by the councils of Manchester, Liverpool and Birmingham. This service was timed to fly north from Croydon in the evening and to return south next morning, in order to provide connections to and from European airports from Croydon.",London is related to Croydon Airport,GS
"Summer 1930: Imperial Airways operated a thrice-weekly scheduled service to London's Croydon Airport via Castle Bromwich Aerodrome, Birmingham, subsidised by the councils of Manchester, Liverpool and Birmingham. This service was timed to fly north from Croydon in the evening and to return south next morning, in order to provide connections to and from European airports from Croydon.",Imperial Airways is related to Birmingham,MN
1946: Lancashire Aero Club moved from Woodford Aerodrome to Barton and remain based there until 2007.,Lancashire Aero Club is related to 2007,BS
"TreeFolks empowers central Texans to build stronger communities through planting and caring for trees. Since 1989, TreeFolks has planted over 1.5 million trees in parks, neighborhoods, and natural areas throughout central Texas.",TreeFolks is related to Texas,MN
"Cooling the Earth by functioning as carbon sinks, and adding water vapor to the atmosphere and thereby increasing cloudiness.",Earth is related to water vapor,BN
the Valencia International Piano Competition Prize Iturbi commenced in 1981 and is often known as the José Iturbi International Piano Competition.,Valencia International Piano Competition Prize Iturbi is related to José Iturbi International Piano Competition,GS
the Valencia International Piano Competition Prize Iturbi commenced in 1981 and is often known as the José Iturbi International Piano Competition.,Valencia International Piano Competition Prize Iturbi is related to 1981,GN
the José Iturbi International Music Competition commenced in 2007 and awards prizes for pianists and opera singers.,José Iturbi International Music Competition is related to 2007,MS
"Kinyongia asheorum (Nečas et al., 2009) – Mount Nyiro bearded chameleon",Kinyongia asheorum is related to 2009,BS
"Kinyongia fischeri (Reichenow, 1887) – Fischer's chameleon",Fischer is related to chameleon,MN
Balacion - a large outrigger sailboat of the Tagalog people in Laguna with three tanja sails.,Tagalog people is related to Laguna,BN
Guilalo - a large outrigger cargo ship of the Tagalog people in Cavite. Characterized by two large settee sails.,Tagalog people is related to Cavite,BN
Owong - small dugout canoes used in Lake Sebu by the T'boli people.,dugout canoes is related to Lake Sebu,MN
Owong - small dugout canoes used in Lake Sebu by the T'boli people.,dugout canoes is related to T'boli people,MN
"Pump boat - corrupted into pambot or pombot, a general term for motorized small bangka.",Pump boat is related to pambot,MS
Dirty Circus - 'Into the Sun' from Alive and Well (2010),Alive is related to 2010,BN
Lights - 'Everybody Breaks a Glass' and 'Flux and Flow' from Siberia (2011),Everybody is related to 2011,BS
Lights - 'Everybody Breaks a Glass' and 'Flux and Flow' from Siberia (2011),Everybody is related to Siberia,BS
'Uncle Wiggily in Connecticut',Uncle Wiggily is related to Connecticut,BS
Extensive works for Emperor Napoleon in France.,Emperor Napoleon is related to France,MS
"Swings (Amosaya, 1999)",Swings is related to 1999,GS
"Johnny Chops (Patuxent, 2008)",Johnny Chops is related to 2008,GS
"Christmas Songs (Telarc, 1992)",Christmas Songs is related to 1992,GS
"Lionel Hampton, Made in Japan (Timeless, 1983)",Lionel Hampton is related to Japan,BS
"Lionel Hampton,  in Japan (Timeless, 1983)",Japan is related to 1983,BS
"In the 1996 movie Space Jam, Hubie and Bertie play the public address announcers during the basketball game where Michael Jordan and the Looney Tunes compete against the MonStars. Bertie's announcer voice was provided by Steve Kehela.",Michael Jordan is related to MonStars,BN
"One day, during a stroll at a park, Ashoka and his concubines came across a beautiful Ashoka tree. The sight put him in an amorous mood, but the women did not enjoy caressing his rough skin. Sometime later, when Ashoka fell asleep, the resentful women chopped the flowers and the branches of his namesake tree. After Ashoka woke up, he burnt 500 of his concubines to death as punishment.",Ashoka is related to One day,BS
"Alarmed by the king's involvement in such massacres, prime minister Radha-Gupta proposed hiring an executioner to carry out future mass killings to leave the king unsullied. Girika, a Magadha village boy who boasted that he could execute the whole of Jambudvipa, was hired for the purpose. He came to be known as Chandagirika ('Girika the fierce'), and on his request, Ashoka built a jail in Pataliputra. Called Ashoka's Hell, the jail looked pleasant from the outside, but inside it, Girika brutally tortured the prisoners.",Ashoka is related to Hell,BN
"Alarmed by the king's involvement in such massacres, prime minister Radha-Gupta proposed hiring an executioner to carry out future mass killings to leave the king unsullied. Girika, a Magadha village boy who boasted that he could execute the whole of Jambudvipa, was hired for the purpose. He came to be known as Chandagirika ('Girika the fierce'), and on his request, Ashoka built a jail in Pataliputra. Called Ashoka's Hell, the jail looked pleasant from the outside, but inside it, Girika brutally tortured the prisoners.",Ashoka is related to Pataliputra,MN
"Nalanda Mahavihara (some portions like Sariputta Stupa), Bihar, India",Nalanda Mahavihara is related to Sariputta Stupa,MS
"Taxila University (some portions like Dharmarajika Stupa and Kunala Stupa), Taxila, Pakistan",Taxila University is related to Dharmarajika Stupa,MS
"According to Sri Lankan tradition, this brother was Tissa, who initially lived a luxurious life, without worrying about the world. To teach him a lesson, Ashoka put him on the throne for a few days, then accused him of being an usurper, and sentenced him to die after seven days. During these seven days, Tissa realised that the Buddhist monks gave up pleasure because they were aware of the eventual death. He then left the palace, and became an arhat.",Tissa is related to seven days,BS
"According to Sri Lankan tradition, this brother was Tissa, who initially lived a luxurious life, without worrying about the world. To teach him a lesson, Ashoka put him on the throne for a few days, then accused him of being an usurper, and sentenced him to die after seven days. During these seven days, Tissa realised that the Buddhist monks gave up pleasure because they were aware of the eventual death. He then left the palace, and became an arhat.",Ashoka is related to seven days,BS
"The Theragatha commentary calls this brother Vitashoka. According to this legend, one day, Vitashoka saw a grey hair on his head, and realised that he had become old. He then retired to a monastery, and became an arhat.",Vitashoka is related to one day,BS
"In the Major Rock Edict 8, he records his visit to Sambodhi (the sacred Bodhi Tree at Bodh Gaya), ten years after his coronation.",Sambodhi is related to Bodh Gaya,GN
"Jaishankar Prasad composed Ashoka ki Chinta (Ashoka's Anxiety), a poem that portrays Ashoka's feelings during the war on Kalinga.",Jaishankar Prasad is related to Ashoka ki Chinta,GS
"Jaishankar Prasad composed Ashoka ki Chinta (Ashoka's Anxiety), a poem that portrays Ashoka's feelings during the war on Kalinga.",Ashoka is related to Anxiety,MN
"Samrat Ashok, a 1928 Indian silent film by Bhagwati Prasad Mishra.",Samrat Ashok is related to Bhagwati Prasad Mishra,GS
"In 1973, Amar Chitra Katha released a graphic novel based on the life of Ashoka.",Amar Chitra Katha is related to 1973,BS
"In 2002, Mason Jennings released the song 'Emperor Ashoka' on his Living in the Moment EP. It is based on the life of Ashoka.",Mason Jennings is related to 2002,BN
"2014's The Emperor's Riddles, a fiction mystery thriller novel by Satyarth Nayak, traces the evolution of Ashoka and his esoteric legend of the Nine Unknown Men.",Emperor is related to Riddles,BN
"2014's The Emperor's Riddles, a fiction mystery thriller novel by Satyarth Nayak, traces the evolution of Ashoka and his esoteric legend of the Nine Unknown Men.",2014 is related to Riddles,BS
"In 2015, Chakravartin Ashoka Samrat, a television serial by Ashok Banker, based on the life of Ashoka, began airing on Colors TV where Siddharth Nigam played the role of Ashoka.",Chakravartin Ashoka Samrat is related to 2015,BN
"In 2015, Chakravartin Ashoka Samrat, a television serial by Ashok Banker, based on the life of Ashoka, began airing on Colors TV where Siddharth Nigam played the role of Ashoka.",Chakravartin Ashoka Samrat is related to Colors TV,GS
"In 2015, Chakravartin Ashoka Samrat, a television serial by Ashok Banker, based on the life of Ashoka, began airing on Colors TV where Siddharth Nigam played the role of Ashoka.",Chakravartin Ashoka Samrat is related to Ashok Banker,GS
"In 2015, Chakravartin Ashoka Samrat, a television serial by Ashok Banker, based on the life of Ashoka, began airing on Colors TV where Siddharth Nigam played the role of Ashoka.",Chakravartin Ashoka Samrat is related to 2015,GS
"In 2015, Chakravartin Ashoka Samrat, a television serial by Ashok Banker, based on the life of Ashoka, began airing on Colors TV where Siddharth Nigam played the role of Ashoka.",Chakravartin Ashoka Samrat is related to Colors TV,GS
"In 2015, Chakravartin Ashoka Samrat, a television serial by Ashok Banker, based on the life of Ashoka, began airing on Colors TV where Siddharth Nigam played the role of Ashoka.",Siddharth Nigam is related to Ashoka,GN
"Gus Greenlee, became a highly successful businessman in Pittsburgh, Pennsylvania; bought the Pittsburgh Crawfords, founded the second Negro National League, and built Greenlee Field, one of the few ballparks owned by a black team",Gus Greenlee is related to Pennsylvania,MS
"Gus Greenlee, became a highly successful businessman in Pittsburgh, Pennsylvania; bought the Pittsburgh Crawfords, founded the second Negro National League, and built Greenlee Field, one of the few ballparks owned by a black team",Gus Greenlee is related to Pittsburgh,MS
"Gus Greenlee, became a highly successful businessman in Pittsburgh, Pennsylvania; bought the Pittsburgh Crawfords, founded the second Negro National League, and built Greenlee Field, one of the few ballparks owned by a black team",Gus Greenlee is related to Pennsylvania,MS
"Gus Greenlee, became a highly successful businessman in Pittsburgh, Pennsylvania; bought the Pittsburgh Crawfords, founded the second Negro National League, and built Greenlee Field, one of the few ballparks owned by a black team",Pittsburgh Crawfords is related to Negro National League,BS
"Gus Greenlee, became a highly successful businessman in Pittsburgh, Pennsylvania; bought the Pittsburgh Crawfords, founded the second Negro National League, and built Greenlee Field, one of the few ballparks owned by a black team",Pittsburgh Crawfords is related to Greenlee Field,GS
"Gus Greenlee, became a highly successful businessman in Pittsburgh, Pennsylvania; bought the Pittsburgh Crawfords, founded the second Negro National League, and built Greenlee Field, one of the few ballparks owned by a black team",Gus Greenlee is related to Pennsylvania,MS
"Gus Greenlee, became a highly successful businessman in Pittsburgh, Pennsylvania; bought the Pittsburgh Crawfords, founded the second Negro National League, and built Greenlee Field, one of the few ballparks owned by a black team",Gus Greenlee is related to Pittsburgh,MS
"Gus Greenlee, became a highly successful businessman in Pittsburgh, Pennsylvania; bought the Pittsburgh Crawfords, founded the second Negro National League, and built Greenlee Field, one of the few ballparks owned by a black team",Gus Greenlee is related to Pennsylvania,MS
"Gus Greenlee, became a highly successful businessman in Pittsburgh, Pennsylvania; bought the Pittsburgh Crawfords, founded the second Negro National League, and built Greenlee Field, one of the few ballparks owned by a black team",Gus Greenlee is related to Pittsburgh,MS
"Gus Greenlee, became a highly successful businessman in Pittsburgh, Pennsylvania; bought the Pittsburgh Crawfords, founded the second Negro National League, and built Greenlee Field, one of the few ballparks owned by a black team",Pittsburgh Crawfords is related to Negro National League,BS
"Gus Greenlee, became a highly successful businessman in Pittsburgh, Pennsylvania; bought the Pittsburgh Crawfords, founded the second Negro National League, and built Greenlee Field, one of the few ballparks owned by a black team",Pittsburgh Crawfords is related to Greenlee Field,BS
"Gus Greenlee, became a highly successful businessman in Pittsburgh, Pennsylvania; bought the Pittsburgh Crawfords, founded the second Negro National League, and built Greenlee Field, one of the few ballparks owned by a black team",Gus Greenlee is related to Pennsylvania,MS
"Dwayne Ledford, former NFL player, current Offensive Line Coach for the Atlanta Falcons",Dwayne Ledford is related to Atlanta Falcons,GS
"Sara McMann, MMA fighter and Olympic silver medalist in women's freestyle wrestling at the 2004 Summer Olympics",Sara McMann is related to 2004 Summer Olympics,GS
"Orlando Meléndez, basketball player for the Harlem Globetrotters",Orlando Meléndez is related to Harlem Globetrotters,GS
"Lars Anderson, first baseman for the Toronto Blue Jays",Lars Anderson is related to Toronto Blue Jays,GS
"Zach Green, MLB first baseman for the San Francisco Giants",Zach Green is related to San Francisco Giants,GS
"Rhys Hoskins, MLB first baseman for the Philadelphia Phillies",Rhys Hoskins is related to Philadelphia Phillies,GS
"J. P. Howell, pitcher for the Toronto Blue Jays",J. P. Howell is related to Toronto Blue Jays,GS
"Andrew Susac, catcher for the Baltimore Orioles",Andrew Susac is related to Baltimore Orioles,GS
"Isaac Fontaine, NBA basketball player with the Memphis Grizzlies",Isaac Fontaine is related to Memphis Grizzlies,GS
